{
  "$id": "studio://schemas/v2/IMPLEMENTATION_HANDOFF.schema.json",
  "$schema": "https://json-schema.org/draft/2020-12/schema",
  "additionalProperties": false,
  "description": "Versioned Studio V2 artifact contract; unknown top-level fields are rejected.",
  "properties": {
    "authority": {
      "minLength": 1,
      "type": "string"
    },
    "base_sha": {
      "pattern": "^[0-9a-f]{40}$",
      "type": "string"
    },
    "branch": {
      "minLength": 1,
      "type": "string"
    },
    "claimed_outcomes": {
      "items": {
        "minLength": 1,
        "type": "string"
      },
      "type": "array"
    },
    "commands": {
      "items": {
        "minLength": 1,
        "type": "string"
      },
      "type": "array"
    },
    "committed_diff_stat": {
      "minLength": 1,
      "type": "string"
    },
    "created_at": {
      "format": "date-time",
      "type": "string"
    },
    "dirty_diff_stat": {
      "minLength": 1,
      "type": "string"
    },
    "document_id": {
      "minLength": 1,
      "pattern": "^[A-Z][A-Z0-9]*(?:-[A-Z0-9]+)*$",
      "type": "string"
    },
    "evidence": {
      "items": {
        "additionalProperties": true,
        "type": "object"
      },
      "type": "array"
    },
    "files": {
      "items": {
        "minLength": 1,
        "type": "string"
      },
      "type": "array"
    },
    "head_sha": {
      "pattern": "^[0-9a-f]{40}$",
      "type": "string"
    },
    "next_action": {
      "minLength": 1,
      "type": "string"
    },
    "owner": {
      "minLength": 1,
      "type": "string"
    },
    "project_id": {
      "minLength": 1,
      "pattern": "^PRJ-[A-Z0-9]+(?:-[A-Z0-9]+)*$",
      "type": "string",
      "x-studio-reference": "project.project_id"
    },
    "repository": {
      "minLength": 1,
      "type": "string"
    },
    "reviewed_state": {
      "additionalProperties": true,
      "type": "object"
    },
    "reviewer_action": {
      "minLength": 1,
      "type": "string"
    },
    "schema": {
      "minLength": 1,
      "type": "string"
    },
    "scope_delta": {
      "additionalProperties": true,
      "type": "object"
    },
    "sequence": {
      "minimum": 1,
      "type": "integer"
    },
    "sources": {
      "items": {
        "minLength": 1,
        "type": "string"
      },
      "type": "array"
    },
    "status": {
      "enum": [
        "DRAFT",
        "PROPOSED",
        "APPROVED",
        "FROZEN",
        "IN_PROGRESS",
        "PROVING",
        "IN_REVIEW",
        "ACCEPTED",
        "CLOSED",
        "RELEASED",
        "PASS",
        "PASS_WITH_LIMITATIONS",
        "BLOCKED",
        "NOT_RUN",
        "UNPROVEN"
      ],
      "type": "string"
    },
    "title": {
      "minLength": 1,
      "type": "string"
    },
    "unproven": {
      "items": {
        "minLength": 1,
        "type": "string"
      },
      "type": "array"
    },
    "verification": {
      "items": {
        "additionalProperties": true,
        "type": "object"
      },
      "type": "array"
    },
    "version": {
      "const": "2.0.0",
      "type": "string"
    },
    "wp_id": {
      "minLength": 1,
      "pattern": "^WP-[A-Z0-9]+(?:-[A-Z0-9]+)*$",
      "type": "string",
      "x-studio-reference": "work_package.wp_id"
    }
  },
  "required": [
    "document_id",
    "wp_id",
    "base_sha",
    "head_sha",
    "branch",
    "claimed_outcomes",
    "files",
    "commands",
    "evidence",
    "scope_delta",
    "unproven",
    "next_action",
    "reviewer_action"
  ],
  "title": "Studio V2 IMPLEMENTATION_HANDOFF artifact",
  "type": "object",
  "x-studio-version": "2.0.0"
}
