{
  "base_sha": "dee9454070ba15ecf1c87f110b3db6cef1c59820",
  "branch": "studio-v2-bootstrap",
  "claimed_outcomes": [
    "current repository state is packaged for independent review"
  ],
  "commands": [
    "python scripts/build_studio.py",
    "python scripts/validate_studio.py",
    "python scripts/run_evals.py"
  ],
  "created_at": "2026-08-30T19:34:00Z",
  "document_id": "HANDOFF-DEE9454070BA",
  "evidence": [
    {
      "level": "E2",
      "observed": "handoff generated from live Git state"
    }
  ],
  "files": [
    "bootstrap/CHATGPT_INSTALL_RECEIPT.md               | 18 ++++++-----",
    "bootstrap/CODEX_INSTALL_RECEIPT.md                 |  6 ++--",
    "bootstrap/CONNECTED_APPS_RECEIPT.md                | 20 ++++++------",
    "bootstrap/FINAL_ACCEPTANCE.md                      | 36 ++++++++++++----------",
    "bootstrap/HANDOFF-VERSION-METADATA.md              |  4 +--",
    "bootstrap/PILOT_A_RECEIPT.md                       | 21 ++++++-------",
    "bootstrap/PILOT_B_RECEIPT.md                       | 22 ++++++-------",
    "bootstrap/ROLLBACK.md                              |  6 ++--",
    "evals/pilots/brownfield/.project/state.json        | 10 +++---",
    ".../brownfield/.project/work-packages/WP-001.json  |  4 +--",
    "evals/pilots/greenfield/.project/state.json        | 10 +++---",
    ".../greenfield/.project/work-packages/WP-001.json  |  4 +--",
    "12 files changed, 83 insertions(+), 78 deletions(-)"
  ],
  "head_sha": "dee9454070ba15ecf1c87f110b3db6cef1c59820",
  "next_action": "independent fresh-context review",
  "reviewer_action": "inspect requirements, current SHA, diff, CI/runtime evidence before this conclusion",
  "schema": "studio.handoff/v2",
  "scope_delta": {
    "status": "REVIEW_REQUIRED"
  },
  "unproven": [
    "fresh ChatGPT installation and review",
    "mobile availability",
    "external write smoke test"
  ],
  "wp_id": "WP-001"
}
