{
  "base_sha": "c2d9bcfeefe9819413a7262edd676332ef73613d",
  "branch": "studio-v2-bootstrap",
  "claimed_outcomes": [
    "current repository state is packaged for independent review"
  ],
  "commands": [
    "python scripts/build_studio.py",
    "python scripts/validate_studio.py",
    "python scripts/run_evals.py"
  ],
  "created_at": "2026-08-30T17:10:16Z",
  "document_id": "HANDOFF-C2D9BCFEEFE9",
  "evidence": [
    {
      "level": "E2",
      "observed": "handoff generated from live Git state"
    }
  ],
  "files": [
    "scripts/studio.py | 4 ++--",
    "1 file changed, 2 insertions(+), 2 deletions(-)"
  ],
  "head_sha": "c2d9bcfeefe9819413a7262edd676332ef73613d",
  "next_action": "independent fresh-context review",
  "reviewer_action": "inspect requirements, current SHA, diff, CI/runtime evidence before this conclusion",
  "schema": "studio.handoff/v2",
  "scope_delta": {
    "status": "REVIEW_REQUIRED"
  },
  "unproven": [
    "fresh ChatGPT installation and review",
    "mobile availability",
    "external write smoke test"
  ],
  "wp_id": "WP-001"
}
