{
  "base_sha": "8f8e9fc2164a1ceeb503aecb36edbf8dc8c48dd6",
  "branch": "studio-v2-bootstrap",
  "claimed_outcomes": [
    "current repository state is packaged for independent review"
  ],
  "commands": [
    "python scripts/build_studio.py",
    "python scripts/validate_studio.py",
    "python scripts/run_evals.py"
  ],
  "created_at": "2026-08-30T20:52:34Z",
  "document_id": "HANDOFF-8F8E9FC2164A",
  "evidence": [
    {
      "level": "E2",
      "observed": "handoff generated from live Git state"
    }
  ],
  "files": [
    ".../brownfield/.project/handoffs/HANDOFF-4AFAA3D17BE2.json     |  4 ++--",
    "evals/pilots/brownfield/.project/state.json                    | 10 +++++-----",
    "evals/pilots/brownfield/.project/work-packages/WP-001.json     |  4 ++--",
    ".../greenfield/.project/handoffs/HANDOFF-4AFAA3D17BE2.json     |  4 ++--",
    "evals/pilots/greenfield/.project/state.json                    | 10 +++++-----",
    "evals/pilots/greenfield/.project/work-packages/WP-001.json     |  4 ++--",
    "6 files changed, 18 insertions(+), 18 deletions(-)"
  ],
  "head_sha": "8f8e9fc2164a1ceeb503aecb36edbf8dc8c48dd6",
  "next_action": "independent fresh-context review",
  "reviewer_action": "inspect requirements, current SHA, diff, CI/runtime evidence before this conclusion",
  "schema": "studio.handoff/v2",
  "scope_delta": {
    "status": "REVIEW_REQUIRED"
  },
  "unproven": [
    "fresh ChatGPT installation and review",
    "mobile availability",
    "external write smoke test"
  ],
  "wp_id": "WP-001"
}
